"Nr","name","street","zip","city","openingHours","phone","fax","mail","web","facebook","speakerPrivate","speakerPublic","spokenLanguages","tags","description","F17","F18","F19","F20","F21","F22","F23","F24","F25","F26","F27"
"51","Jugendwerk Dresden","Oberwachwitzer Weg 13","01326 ","Dresden","0","0",0.00,"change@betterplace.org","https://www.betterplace.org/en/organisations/jugendwerkdresden","0","0","0","0","0","0",,,,,,,,,,,
"52","Initiative für Flüchtlinge Bühlau-Rochwitz","0","0","Dresden","0","0",0.00,"Christian-karpf@gmx.de","0","0","Christian Karpf","Christian Karpf","0","0","0",,,,,,,,,,,
"53","German lessons für Refugees Dresden","Bibliothèque à l'intérieur du World Trade Center et Bibliothèque municipale de Neustadt (Königsbrücker Str.)","0","Dresden","0","0",0.00,"0","0","https://www.facebook.com/GermanLessonsforRefugees","0","","0","0","cours à la bibliothèque (à Neustadt et à la bibliothèque centrale)",,,,,,,,,,,
"54","Women* refugee meeting","M.-Luther-Str. 13","0","Dresden","0","0",0.00,"0","0","0","0","0","0","0","offre multilingue: activités de loisirs divers pour réfugiées (femmes) : cuisine et alimentation, danse, activités sportives, rencontre avec des femmes allemandes...",,,,,,,,,,,
"55","TOLERADE","0","0","Dresden","0","0176 / 22 77 85 48",0.00,"tolerave@gmail.com","0","0","Dana Bondartschuk ","0","0","0","Défilé musical visant à lutter contre les tendances xénophobes à Dresde (et en Saxe). Son but est de refléter la diversité des cultures à Dresde.",,,,,,,,,,,